,journal,authors,buzz_id,date,name,doi,pii
188,Agricultural Water Management,"['Mayra González-Delgado', 'Rafael Minjares-Fuentes', 'Antoni Femenia']",7,2023-07-01,Joint water and salinity stresses increase the bioactive compounds of <ce:italic>Aloe vera</ce:italic> (<ce:italic>Aloe barbadensis</ce:italic> Miller) gel enhancing its related functional properties,10.1016/j.agwat.2023.108374,S0378377423002391
189,Agricultural Water Management,"['Declan Page', 'Joanne Vanderzalm', 'Pascal Castellazzi']",7,2023-07-01,"Managed aquifer recharge for agriculture in Australia – History, success factors and future implementation",10.1016/j.agwat.2023.108382,S0378377423002470
190,Agricultural Water Management,"['Qingsong Zhang', 'Jiahao Sun', 'Boting Hu']",7,2023-07-01,Spatiotemporal dynamics of water supply–demand patterns under large-scale paddy expansion: Implications for regional sustainable water resource management,10.1016/j.agwat.2023.108388,S0378377423002536
191,Agricultural Water Management,"['Shenglin Wen', 'Ningbo Cui', 'Jiaxin Wang']",8,2023-09-01,"A global meta-analysis of yield and water productivity of woody, herbaceous and vine fruits under deficit irrigation",10.1016/j.agwat.2023.108412,S0378377423002779
192,Agricultural Water Management,"['Zheli Zhu', 'Guanghua Guan', 'Kang Wang']",8,2023-07-01,Distributed model predictive control based on the alternating direction method of multipliers for branching open canal irrigation systems,10.1016/j.agwat.2023.108372,S0378377423002378
193,Agricultural Water Management,"['Dimitrios Savvas', 'Evangelos Giannothanasis', 'Georgia Ntatsi']",8,2023-07-01,Improvement and validation of a decision support system to maintain optimal nutrient levels in crops grown in closed-loop soilless systems,10.1016/j.agwat.2023.108373,S037837742300238X
194,Agricultural Water Management,"['Rogério de S. Nóia Júnior', 'Senthold Asseng', 'Matthew Tom Harrison']",8,2023-06-30,A call to action for global research on the implications of waterlogging for wheat growth and yield,10.1016/j.agwat.2023.108334,S0378377423001993
195,Agricultural Water Management,"['Shan Zhou', 'Tiesong Hu', 'Xin Wang']",8,2023-06-30,A bilevel modeling approach for optimizing irrigation canal scheduling under a hierarchical institutional arrangement,10.1016/j.agwat.2023.108322,S0378377423001877
196,Agricultural Water Management,"['Louise Malmquist', 'Jennie Barron']",8,2023-06-01,Improving spatial resolution in soil and drainage data to combine natural and anthropogenic water functions at catchment scale in agricultural landscapes,10.1016/j.agwat.2023.108304,S0378377423001695
197,Agricultural Water Management,"['Huifang Zheng', 'Peipei Mei', 'Zhenling Cui']",8,2023-05-31,"Effects of super absorbent polymer on crop yield, water productivity and soil properties: A global meta-analysis",10.1016/j.agwat.2023.108290,S0378377423001555
198,Agricultural Water Management,"['Mohsen Hosseini Jolfan', 'S. Mehdy Hashemy Shahdany', 'Hamed Tork']",8,2023-05-31,Modernization in agricultural water distribution system for aquifer storage and recovery – A case study,10.1016/j.agwat.2023.108270,S037837742300135X
199,Agricultural Water Management,"['Bryana Funk', 'Saud A. Amer', 'Frank A. Ward']",8,2023-05-01,Sustainable aquifer management for food security,10.1016/j.agwat.2022.108073,S0378377422006205
200,Agricultural Water Management,"['Xianghui Xu', 'Yingshan Chen', 'Mo Li']",8,2023-04-30,Sustainable management of agricultural water rights trading under uncertainty: An optimization-evaluation framework,10.1016/j.agwat.2023.108212,S037837742300077X
201,Agricultural Water Management,"['Bo Wang', 'Jos van Dam', 'Shaozhong Kang']",8,2023-04-30,Reducing water productivity gap by optimizing irrigation regime for winter wheat-summer maize system in the North China Plain,10.1016/j.agwat.2023.108229,S037837742300094X
202,Agricultural Water Management,"['Lingling Hou', 'Shi Min', 'Jikun Huang']",8,2023-04-01,Farmers' perceptions of drought-severity and the impacts on <ce:italic>ex-ante</ce:italic> and <ce:italic>ex-post</ce:italic> adaptations to droughts: Evidence from maize farmers in China,10.1016/j.agwat.2023.108180,S0378377423000458
203,Agricultural Water Management,"['Rui Zhang', 'Katsutoshi Seki', 'Li Wang']",8,2023-04-01,Quantifying the contribution of meteorological factors and plant traits to canopy interception under maize cropland,10.1016/j.agwat.2023.108195,S0378377423000604
204,Agricultural Water Management,"['Sumon Datta', 'Saleh Taghvaeian']",8,2023-03-31,Soil water sensors for irrigation scheduling in the United States: A systematic review of literature,10.1016/j.agwat.2023.108148,S0378377423000136
205,Agricultural Water Management,"['Ying Wang', 'Wenjuan Shi', 'Tianyang Wen']",8,2023-03-01,Prediction of winter wheat yield and dry matter in North China Plain using machine learning algorithms for optimal water and nitrogen application,10.1016/j.agwat.2023.108140,S0378377423000057
206,Agricultural Water Management,"['Aatira Farooq', 'Ajit Kumar Verma', 'Manjulesh Pai']",8,2023-03-01,Iron supplementation in aquaculture wastewater and its effect on the growth of spinach and pangasius in nutrient film technique based aquaponics,10.1016/j.agwat.2022.108126,S0378377422006734
207,Agricultural Water Management,"['Fatemeh Saeidnia', 'Mohammad Mahdi Majidi', 'Elaheh Hosseini']",8,2023-03-01,Simultaneous effect of water deficit and mating systems in fennel (<ce:italic>Foeniculum vulgare</ce:italic> mill.): Genetics of phytochemical compositions and drought tolerance,10.1016/j.agwat.2022.108122,S0378377422006692
208,Agricultural Water Management,['David Leroy'],8,2023-02-01,An empirical assessment of the institutional performance of community-based water management in a large-scale irrigation system in southern Mexico,10.1016/j.agwat.2022.108051,S0378377422005984
209,Agricultural Water Management,"['Affonso Celso Gonçalves', 'Elio Conradi', 'Juliano Zimmermann']",8,2023-02-01,Atrazine fate in Rhodic Ferralsol grown with corn under high-intensity rainfall conditions,10.1016/j.agwat.2022.108065,S0378377422006126
210,Agricultural Water Management,"['Liangang Xiao', 'Xi Wei', 'Rongqin Zhao']",8,2023-01-01,Plastic film mulching significantly boosts crop production and water use efficiency but not evapotranspiration in China,10.1016/j.agwat.2022.108023,S0378377422005704
211,Agricultural Water Management,"['Franco Emmanuel Calvo', 'Eduardo Rafael Trentacoste', 'Sonia Teresa Silvente']",8,2022-12-01,"Vegetative growth, yield, and crop water productivity response to different irrigation regimes in high density walnut orchards (Juglans regia L.) in a semi-arid environment in Argentina",10.1016/j.agwat.2022.107969,S0378377422005169
212,Agricultural Water Management,"['Gebremeskel Teklay Berhe', 'Jantiene E. M. Baartman', 'Coen J. Ritsema']",8,2022-12-01,"Irrigation development and management practices in Ethiopia: A systematic review on existing problems, sustainability issues and future directions",10.1016/j.agwat.2022.107959,S0378377422005066
213,Agricultural Water Management,"['Luis Fernando Perez-Mercado', 'Cecilia Lalander', 'Björn Vinnerås']",8,2022-07-01,Managing microbial risks in informal wastewater-irrigated agriculture through irrigation water substitution,10.1016/j.agwat.2022.107733,S0378377422002803
214,Agricultural Water Management,"['Saher Ayyad', 'Poolad Karimi', 'Mathias Becker']",8,2022-07-01,Remote sensing assessment of available green water to increase crop production in seasonal floodplain wetlands of sub-Saharan Africa,10.1016/j.agwat.2022.107712,S0378377422002591
215,Agricultural Water Management,"['Benson Mutuma Karimba', 'Annelieke Duker', 'Pieter van der Zaag']",8,2022-05-01,Irrigation on the move: How transient farming partnerships facilitate the expansion of smallholder irrigation along ephemeral rivers in dryland areas of Kenya,10.1016/j.agwat.2022.107526,S0378377422000737
216,Agricultural Water Management,"['Jorge Alvar-Beltrán', 'Coulibaly Saturnin', 'Anna Dalla Marta']",9,2023-09-01,Using AquaCrop as a decision-support tool for improved irrigation management in the Sahel region,10.1016/j.agwat.2023.108430,S0378377423002950
217,Agricultural Water Management,"['Haichao Yu', 'Sien Li', 'Yuexin Wang']",9,2023-09-01,Water use efficiency and its drivers of two typical cash crops in an arid area of Northwest China,10.1016/j.agwat.2023.108433,S0378377423002986
218,Agricultural Water Management,"['Wenlong Li', 'Xiaobo Gu', 'Tian Chang']",9,2023-09-01,"Optimizing nitrogen, phosphorus, and potassium fertilization regimes to improve maize productivity under double ridge-furrow planting with full film mulching",10.1016/j.agwat.2023.108439,S0378377423003049
219,Agricultural Water Management,"['Ruiyun Zeng', 'Xiaomao Lin', 'Fengmei Yao']",9,2023-09-01,Impact of water deficit and irrigation management on winter wheat yield in China,10.1016/j.agwat.2023.108431,S0378377423002962
220,Agricultural Water Management,"['Qi Wu', 'Fuzheng Gong', 'Daocai Chi']",9,2023-09-01,Maintaining rice grain yield under two irrigation regimes while reducing water-nitrogen input using acidified nitrogen-loaded biochar,10.1016/j.agwat.2023.108432,S0378377423002974
221,Agricultural Water Management,"['Michael Cahn', 'Richard Smith', 'Forrest Melton']",9,2023-09-01,Field evaluations of the CropManage decision support tool for improving irrigation and nutrient use of cool season vegetables in California,10.1016/j.agwat.2023.108401,S0378377423002664
222,Agricultural Water Management,"['Yue Wen', 'Xiaodi Wu', 'Zhenhua Wang']",9,2023-09-01,"Effects of drip irrigation timing and water temperature on soil conditions, cotton phenological period, and fiber quality under plastic film mulching",10.1016/j.agwat.2023.108435,S0378377423003001
223,Agricultural Water Management,"['Jianjun Wang', 'Chuantao Wang', 'Bingcheng Si']",9,2023-09-01,Rock water use by apple trees affected by physical properties of the underlying weathered rock,10.1016/j.agwat.2023.108413,S0378377423002780
224,Agricultural Water Management,"['Jessica Penny', 'Carlos M. Ordens', 'Albert S. Chen']",9,2023-09-01,"Vineyards, vegetables or business-as-usual? Stakeholder-informed land use change modelling to predict the future of a groundwater-dependent prime-wine region under climate change",10.1016/j.agwat.2023.108417,S0378377423002822
225,Agricultural Water Management,"['Caixia Li', 'Guangshuai Wang', 'Di Feng']",9,2023-09-01,Soil moisture and water-nitrogen synergy dominate the change of soil carbon stock in farmland,10.1016/j.agwat.2023.108424,S0378377423002895
226,Agricultural Water Management,"['Rachel E. Schattman', 'Haley Jean', 'Tsutomu Ohno']",9,2023-09-01,Effects of irrigation scheduling approaches on soil moisture and vegetable production in the Northeastern U.S.A.,10.1016/j.agwat.2023.108428,S0378377423002937
227,Agricultural Water Management,"['Sean Comber', 'Paul Lunt', 'Rob Schindler']",9,2023-09-01,Restoration management of phosphorus pollution on lowland fen peatlands: A data evidence review from the Somerset Levels and Moors,10.1016/j.agwat.2023.108419,S0378377423002846
228,Agricultural Water Management,"['Suat Irmak', 'Ali T. Mohammed', 'Matthew Drudik']",9,2023-09-01,"Maize nitrogen uptake, grain nitrogen concentration and root-zone residual nitrate nitrogen response under center pivot, subsurface drip and surface (furrow) irrigation",10.1016/j.agwat.2023.108421,S037837742300286X
229,Agricultural Water Management,"['María Arias', 'Claudia Notarnicola', 'Jesús Álvarez-Mozos']",9,2023-09-01,Evaluation of soil moisture estimation techniques based on Sentinel-1 observations over wheat fields,10.1016/j.agwat.2023.108422,S0378377423002871
230,Agricultural Water Management,"['J. Cedeño', 'J. J. Magán', 'M. Gallardo']",9,2023-09-01,Reducing nutrient loss in drainage from tomato grown in free-draining substrate in greenhouses using dynamic nutrient management,10.1016/j.agwat.2023.108418,S0378377423002834
231,Agricultural Water Management,"['Hong Wang', 'Fubao Sun', 'Yao Feng']",9,2023-09-01,Reconstruction of the pan evaporation based on meteorological factors with machine learning method over China,10.1016/j.agwat.2023.108416,S0378377423002810
232,Agricultural Water Management,"['Wenliang Wan', 'Liulong Li', 'Dong Jiang']",9,2023-09-01,Border effects enhance lodging resistance of spring wheat in narrowing-row-space enlarged-lateral-space drip irrigation patterns,10.1016/j.agwat.2023.108409,S0378377423002743
233,Agricultural Water Management,"['Liuyue He', 'Jingyuan Xue', 'Sufen Wang']",9,2023-09-01,WHCrop: A novel water-heat driven crop model for estimating the spatiotemporal dynamics of crop growth for arid region,10.1016/j.agwat.2023.108410,S0378377423002755
234,Agricultural Water Management,"['A. Garcia-Prats', 'J. M. Carricondo-Anton', 'M. Pulido-Velazquez']",9,2023-09-01,Dynamic procedure for daily PM56 ETo mapping conducive to site-specific irrigation recommendations in areas covered by agricultural weather networks,10.1016/j.agwat.2023.108415,S0378377423002809
235,Agricultural Water Management,"['Ivan Ntege', 'Nicholas Kiggundu', 'Prossie Nakawuka']",9,2023-09-01,Napier yield response under different irrigation strategies in a tropical setting,10.1016/j.agwat.2023.108403,S0378377423002688
236,Agricultural Water Management,"['M. Ndung’u', 'J. N. Mugwe', 'D. N. Mugendi']",9,2023-08-01,Tied-ridging and soil inputs enhance small-scale maize productivity and profitability under erratic rainfall conditions in central Kenya,10.1016/j.agwat.2023.108390,S037837742300255X
237,Agricultural Water Management,"['Zhenheng Xu', 'Hao Sun', 'JinHua Gao']",9,2023-08-01,Evaluating established deep learning methods in constructing integrated remote sensing drought index: A case study in China,10.1016/j.agwat.2023.108405,S0378377423002706
238,Agricultural Water Management,"['Cecilia Berrueta', 'Rafael Grasso', 'Marisa Gallardo']",9,2023-08-01,"Use of the VegSyst model to simulate seasonal dry matter production, N and K uptake and evapotranspiration in greenhouse soil-grown tomato in Uruguay",10.1016/j.agwat.2023.108395,S0378377423002603
239,Agricultural Water Management,"['Julia Arbizu-Milagro', 'Francisco J. Castillo-Ruiz', 'Jose M. Peña']",9,2023-08-01,"Effects of regulated, precision and continuous deficit irrigation on the growth and productivity of a young super high-density olive orchard",10.1016/j.agwat.2023.108393,S0378377423002585
240,Agricultural Water Management,"['J. Jacinto', 'J. G. Jesus', 'C. Antunes']",9,2023-08-01,Phloem carbon isotopic signature as a valuable tool to assess physiological adjustments among European grapevine varieties under a Mediterranean climate,10.1016/j.agwat.2023.108396,S0378377423002615
241,Agricultural Water Management,"['Toshisuke Maruyama', 'Sanshiro Fujii', 'Hiroshi Takimoto']",10,2023-09-01,Comparison of estimated and observed evapotranspiration from farmland using inverse analysis and FLUXNET2015,10.1016/j.agwat.2023.108414,S0378377423002792
242,Agricultural Water Management,"['Jorge Alvar-Beltrán', 'Coulibaly Saturnin', 'Anna Dalla Marta']",10,2023-09-01,Using AquaCrop as a decision-support tool for improved irrigation management in the Sahel region,10.1016/j.agwat.2023.108430,S0378377423002950
243,Agricultural Water Management,"['Haichao Yu', 'Sien Li', 'Yuexin Wang']",10,2023-09-01,Water use efficiency and its drivers of two typical cash crops in an arid area of Northwest China,10.1016/j.agwat.2023.108433,S0378377423002986
244,Agricultural Water Management,"['Wenlong Li', 'Xiaobo Gu', 'Tian Chang']",10,2023-09-01,"Optimizing nitrogen, phosphorus, and potassium fertilization regimes to improve maize productivity under double ridge-furrow planting with full film mulching",10.1016/j.agwat.2023.108439,S0378377423003049
245,Agricultural Water Management,"['Tao Yin', 'Zhipeng Yao', 'Wenqing He']",10,2023-09-01,Maize yield reduction is more strongly related to soil moisture fluctuation than soil temperature change under biodegradable film vs plastic film mulching in a semi-arid region of northern China,10.1016/j.agwat.2023.108351,S0378377423002160
246,Agricultural Water Management,"['Ruiyun Zeng', 'Xiaomao Lin', 'Fengmei Yao']",10,2023-09-01,Impact of water deficit and irrigation management on winter wheat yield in China,10.1016/j.agwat.2023.108431,S0378377423002962
247,Agricultural Water Management,"['Michael Cahn', 'Richard Smith', 'Forrest Melton']",10,2023-09-01,Field evaluations of the CropManage decision support tool for improving irrigation and nutrient use of cool season vegetables in California,10.1016/j.agwat.2023.108401,S0378377423002664
248,Agricultural Water Management,"['Yue Wen', 'Xiaodi Wu', 'Zhenhua Wang']",10,2023-09-01,"Effects of drip irrigation timing and water temperature on soil conditions, cotton phenological period, and fiber quality under plastic film mulching",10.1016/j.agwat.2023.108435,S0378377423003001
249,Agricultural Water Management,"['Jianjun Wang', 'Chuantao Wang', 'Bingcheng Si']",10,2023-09-01,Rock water use by apple trees affected by physical properties of the underlying weathered rock,10.1016/j.agwat.2023.108413,S0378377423002780
250,Agricultural Water Management,"['Jamal Elfarkh', 'Kasper Johansen', 'Matthew F. McCabe']",10,2023-09-01,"Evapotranspiration, gross primary productivity and water use efficiency over a high-density olive orchard using ground and satellite based data",10.1016/j.agwat.2023.108423,S0378377423002883
251,Agricultural Water Management,"['Jessica Penny', 'Carlos M. Ordens', 'Albert S. Chen']",10,2023-09-01,"Vineyards, vegetables or business-as-usual? Stakeholder-informed land use change modelling to predict the future of a groundwater-dependent prime-wine region under climate change",10.1016/j.agwat.2023.108417,S0378377423002822
252,Agricultural Water Management,"['Caixia Li', 'Guangshuai Wang', 'Di Feng']",10,2023-09-01,Soil moisture and water-nitrogen synergy dominate the change of soil carbon stock in farmland,10.1016/j.agwat.2023.108424,S0378377423002895
253,Agricultural Water Management,"['Rachel E. Schattman', 'Haley Jean', 'Tsutomu Ohno']",10,2023-09-01,Effects of irrigation scheduling approaches on soil moisture and vegetable production in the Northeastern U.S.A.,10.1016/j.agwat.2023.108428,S0378377423002937
254,Agricultural Water Management,"['Wasi Ul Hassan Shah', 'Gang Hao', 'Yuting Lu']",10,2023-09-01,Role of China's agricultural water policy reforms and production technology heterogeneity on agriculture water usage efficiency and total factor productivity change,10.1016/j.agwat.2023.108429,S0378377423002949
255,Agricultural Water Management,"['Nima Abbasi', 'Yousef Sohrabi', 'Hawre Kiani']",10,2023-09-01,Using tragacanth gum mitigated the effects of drought stress on the black cumin (<ce:italic>Nigella sativa</ce:italic>) plant,10.1016/j.agwat.2023.108406,S0378377423002718
256,Agricultural Water Management,"['Chong Fu', 'Xiaoyu Song', 'Huaiyou Li']",10,2023-09-01,Combining the Generalized Complementary Relationship and the Modified Priestley-Taylor Equation to estimate and partition the evapotranspiration of typical plantations and grasslands in the Loess Plateau of China,10.1016/j.agwat.2023.108420,S0378377423002858
257,Agricultural Water Management,"['Shouzheng Jiang', 'Jie Wu', 'Yu Feng']",10,2023-09-01,Spatiotemporal variations of cropland carbon sequestration and water loss across China,10.1016/j.agwat.2023.108427,S0378377423002925
258,Agricultural Water Management,"['Shenglin Wen', 'Ningbo Cui', 'Jiaxin Wang']",10,2023-09-01,"A global meta-analysis of yield and water productivity of woody, herbaceous and vine fruits under deficit irrigation",10.1016/j.agwat.2023.108412,S0378377423002779
259,Agricultural Water Management,"['Sean Comber', 'Paul Lunt', 'Rob Schindler']",10,2023-09-01,Restoration management of phosphorus pollution on lowland fen peatlands: A data evidence review from the Somerset Levels and Moors,10.1016/j.agwat.2023.108419,S0378377423002846
260,Agricultural Water Management,"['Suat Irmak', 'Ali T. Mohammed', 'Matthew Drudik']",10,2023-09-01,"Maize nitrogen uptake, grain nitrogen concentration and root-zone residual nitrate nitrogen response under center pivot, subsurface drip and surface (furrow) irrigation",10.1016/j.agwat.2023.108421,S037837742300286X
261,Agricultural Water Management,"['María Arias', 'Claudia Notarnicola', 'Jesús Álvarez-Mozos']",10,2023-09-01,Evaluation of soil moisture estimation techniques based on Sentinel-1 observations over wheat fields,10.1016/j.agwat.2023.108422,S0378377423002871
262,Agricultural Water Management,"['Liming Dong', 'Guoqing Lei', 'Wenzhi Zeng']",10,2023-09-01,Improving crop modeling in saline soils by predicting root length density dynamics with machine learning algorithms,10.1016/j.agwat.2023.108425,S0378377423002901
263,Agricultural Water Management,"['Laljeet Sangha', 'Julie Shortridge']",10,2023-09-01,Quantification of unreported water use for supplemental crop irrigation in humid climates using publicly available agricultural data,10.1016/j.agwat.2023.108402,S0378377423002676
264,Agricultural Water Management,"['J. Cedeño', 'J. J. Magán', 'M. Gallardo']",10,2023-09-01,Reducing nutrient loss in drainage from tomato grown in free-draining substrate in greenhouses using dynamic nutrient management,10.1016/j.agwat.2023.108418,S0378377423002834
265,Agricultural Water Management,"['Hong Wang', 'Fubao Sun', 'Yao Feng']",10,2023-09-01,Reconstruction of the pan evaporation based on meteorological factors with machine learning method over China,10.1016/j.agwat.2023.108416,S0378377423002810
266,Agricultural Water Management,"['Jianjun Wang', 'Chuantao Wang', 'Bingcheng Si']",11,2023-09-01,Rock water use by apple trees affected by physical properties of the underlying weathered rock,10.1016/j.agwat.2023.108413,S0378377423002780
267,Agricultural Water Management,"['Jamal Elfarkh', 'Kasper Johansen', 'Matthew F. McCabe']",11,2023-09-01,"Evapotranspiration, gross primary productivity and water use efficiency over a high-density olive orchard using ground and satellite based data",10.1016/j.agwat.2023.108423,S0378377423002883
268,Agricultural Water Management,"['Hong Wang', 'Fubao Sun', 'Yao Feng']",11,2023-09-01,Reconstruction of the pan evaporation based on meteorological factors with machine learning method over China,10.1016/j.agwat.2023.108416,S0378377423002810
269,Agricultural Water Management,"['Zhenheng Xu', 'Hao Sun', 'JinHua Gao']",11,2023-08-01,Evaluating established deep learning methods in constructing integrated remote sensing drought index: A case study in China,10.1016/j.agwat.2023.108405,S0378377423002706
270,Agricultural Water Management,"['Liyuan Zhang', 'Huihui Zhang', 'Yaxiao Niu']",11,2023-07-01,"Further investigating the performance of crop water stress index for maize from baseline fluctuation, effects of environmental factors, and variation of critical value",10.1016/j.agwat.2023.108349,S0378377423002147
271,Agricultural Water Management,"['R. González Perea', 'I. Fernández García', 'J. A. Rodríguez Díaz']",11,2023-06-30,New memory-based hybrid model for middle-term water demand forecasting in irrigated areas,10.1016/j.agwat.2023.108367,S0378377423002329
272,Agricultural Water Management,"['Dirk Raes', 'Elias Fereres', 'Joost Wellens']",11,2023-06-30,Simulation of alfalfa yield with AquaCrop,10.1016/j.agwat.2023.108341,S0378377423002068
273,Agricultural Water Management,"['Louise Malmquist', 'Jennie Barron']",11,2023-06-01,Improving spatial resolution in soil and drainage data to combine natural and anthropogenic water functions at catchment scale in agricultural landscapes,10.1016/j.agwat.2023.108304,S0378377423001695
274,Agricultural Water Management,"['Vishnu Prasad Pandey', 'Nirman Shrestha', 'Timothy J. Krupnik']",11,2023-06-01,Implementing conjunctive management of water resources for irrigation development: A framework applied to the Southern Plain of Western Nepal,10.1016/j.agwat.2023.108287,S037837742300152X
275,Agricultural Water Management,"['Juntao Deng', 'Shijia Pan', 'Wenting Han']",11,2023-05-31,Optimum sampling window size and vegetation index selection for low-altitude multispectral estimation of root soil moisture content for Xuxiang Kiwifruit,10.1016/j.agwat.2023.108297,S0378377423001622
276,Agricultural Water Management,"['Nadia Ouaadi', 'Lionel Jarlan', 'Pierre-Louis Frison']",11,2023-05-31,Are the C-band backscattering coefficient and interferometric coherence suitable substitutes of NDVI for the monitoring of the FAO-56 crop coefficient?,10.1016/j.agwat.2023.108276,S0378377423001415
277,Agricultural Water Management,"['Masoumeh Hashemi', 'Hamed Mazandarani Zadeh', 'Razieh Taraghi Delgarm']",11,2023-05-01,An analysis of why rehabilitation and balancing programs for aquifers do not meet water organizations' targets (a case study of the Qazvin aquifer in Iran),10.1016/j.agwat.2023.108258,S0378377423001233
278,Agricultural Water Management,"['Mohsen Hosseini Jolfan', 'S. Mehdy Hashemy Shahdany', 'Hamed Tork']",11,2023-05-31,Modernization in agricultural water distribution system for aquifer storage and recovery – A case study,10.1016/j.agwat.2023.108270,S037837742300135X
279,Agricultural Water Management,"['Thomás R. Ferreira', 'Mitchell S. Maguire', 'Herica F. S. Carvalho']",11,2023-05-01,Assessment of water demands for irrigation using energy balance and satellite data fusion models in cloud computing: A study in the Brazilian semiarid region,10.1016/j.agwat.2023.108260,S0378377423001257
280,Agricultural Water Management,"['Yajun Zhang', 'Weilu Wang', 'Yun Chen']",11,2023-05-01,Integrated management approaches enabling sustainable rice production under alternate wetting and drying irrigation,10.1016/j.agwat.2023.108265,S0378377423001300
